date,review,rating,isEdited,userName,title,app_name,app_id
2022-10-23 02:39:44,"Here’s the deal! I use this app weekly and have been a monthly customer. But all that is changing as of today.

This whole app is based off of people doing their job. My dasher didn’t follow instructions. I got a message saying need substitutions. I entered them and minutes later it says order cancelled. The protocol is the dasher contacts you. Then they ask if you want a credit or a refund. I would have chosen credit bc I needed the cat food tonight and would have reordered. The dasher didn’t follow protocol a second time. 

So I had to reorder. When I did DoorDash informed me that refunds take 5-7 days to process. Basically, then you are out the $30 bucks a second time for 5-7 days. I talked to an agent, got transferred over 8 times. Then 1 hour and 20 minutes later they gave me a credit for my waste of time, since I said I was leaving their app and no longer going to be a weekly user. Therefore, I will use my $15 credit and cancel my monthly service. Meanwhile my bank makes interest on my $30 bucks for a week, and I am out gas money. There goes the ease of using an app. Go with Uber eats instead!",1,False,melrianwilson,Dashers don’t follow instructions,doordash,719972451
2022-10-24 23:28:59,"Should be 0 stars.  I placed an order and didn’t receive my food.  Door Dash CS said they couldn’t credit my account since I used the restaurant app.  The restaurant told me the same so I was without my money and my lunch.  3 of their dashers were in the restaurant but the restaurant manager stated they told him the order was canceled so they wouldn’t take it.  My app showed 3 different dashers were on their way.  I spoke to DoorDash CS twice and requested a manager and was told one would call me, but if course no one called.  Both times I was put on hold only to be told my order was on the way.  When I told them no one was bringing the order they didn’t care to help or give a resolution for their mistake.  2 1/2 hours later the restaurant credited my account and still no call from DoorDash.  This was the second time I didn’t get my order from DoorDash and didn’t get help so I decided to write a review.  They are unorganized and the CS is worthless in giving any resolution to a serious issue…money out of my account and nothing to show for it, you’re just left with an ‘oh well’ attitude that their customers are ripped off.",1,False,Grnidrose,They canceled my order,doordash,719972451
2022-12-17 00:03:14,"Service and times are mediocre, the tip is being billed before the service is complete, which equals a fact that we can’t tip accordingly, especially  to level of service received. This makes tipping a good faith thing. You don’t understand how many times I wished I could have lowered the tip because the delivery quality or time sucked. Which is totally the reason why I don’t use this or any service often anymore. So why pay for dash pass? That would not be fiscally unreasonable. 

DoorDash inc. isn’t as great as the big headed company thinks it is. It promotes customers to be lazy and wasteful. Over ordering is also too common. 

We all need to stop looking for easy buttons and paying a premium for lackluster service. I’d rather just take the family to the diner anymore, at least there I have a face to face level of service and workers are much more inclined to feel guilty when they neglect a paying customer. And I can always promote or warn the management of there representatives in person.",3,False,Big mojo 2,Service,doordash,719972451
2022-10-31 02:50:30,So I paid for the yearly DoorDash pass back in February throughout the couple of months I’ve had a few times where my order didn’t show up or they bought me the wrong order not that many times but less than less than 10 more than four I made an order today at McDonald’s it came to $30 more I only received my fries and a drink they forgot the other bag I was told they couldn’t give me a refund becauseIt was too many things that went wrong on my account so it doesn’t matter if it’s their fault that they gave you the wrong order and you have pictures of receipts and everything if you complain about not receiving what You’ve paid for they say you’ve had too many unsatisfactory transactions and say sorry but we’re keeping your money even though you didn’t receive your goods they stole my money and will not give it back to me in credits or anything I cancel this account I would not suggest anybody spend any money with these fees what they’re doing is illegal and I am currently talking to my friend who is a civil rights activist because I want to place a class action lawsuit,1,False,Utriedit215,Stole my money,doordash,719972451
2022-11-13 23:55:05,"First of all I never write reviews so this is a first time for me which shows how bad of an experience this was.  I placed an order and had specific instructions to leave an ingredient out of my dish.  The restaurant added the ingredient anyway, which I understand can happen at times.  So I contacted DoorDash about the issue and the mistake on the store’s end.  The DoorDash agent told me I couldn’t get a full refund even though I was not at fault.  After frustratingly going back and forth as to why I couldn’t get a full refund for the stores mistake I agreed to get paid back to my card.  DoorDash issued me credits instead and after I contacted them about their mistake they said there was nothing they could do and I even had an agent disconnect on me mid chat.  I have screenshots and am tempted to take legal action, but I don’t want anything to do with the sorry excuse for a company.  I’ve never had a problem with Grubhub and if there’s an issue they are more than willing to help you out with no issues on their end.

 Also the Double Dash feature doesn’t always work.",1,False,K- Rod,Poor Service and Crooks.  Grubhub is much better!,doordash,719972451
2022-09-29 15:16:08,"I just downloaded DoorDash and began using it a couple of weeks ago. My first experience was abysmal. The DoorDash took my food for herself and claimed to have given it to a valet. Only thing is, my building does not have VALET. Then when I asked her to come back to show me who, she claimed to be far out of the area… it was only one minute after.
You guys did re deliver quickly, so I decided to move forward.
I then ordered late last night after work. After the first dasher dropped off, the second one Kayla was at the location.
I called her and heard the lady at the drive thru window confirming my order over the loud speaker. Then she hung up! So I’m assuming that she took the order for herself. After that hour or so ordeal. I then spend another 40 mins trying to get a resolution from CS. I simply asked for a timely return of my funds and additional compensation in the form of credit for the last two horrible experiences. I’m not fully aware of the policy, but just saying, well we returned your money does not seem to suffice.",2,False,anoyed annoyed,Poor dashers and customer service,doordash,719972451
2022-12-17 17:07:31,"When I placed my order through the Chic fil a app, it routed me to finish the order through DoorDash. I didn’t get a confirmation or anything for 10 mins and I went back to submit my order and it said my Cart is stale (I thought the order never went through since it still had my cart full). Since a reasonable amount of time passed, I opened the DoorDash app and the order didn’t show for me there either so I went ahead and ordered again, thinking it was my first time ordering. When I placed the second order, some time passed before I got the text for the original order and thought it meant my second order (to me being the first) was being made. I opened the app and it showed just one order. A few minutes passed from that and the food arrives. I then get a text that another is on the way. I did not intentionally spend more than $110+ on chick fil a and their support acknowledged they were having technical issues and had me pound sand anyways. I’ll stick with a different service - they’ve lost my business.",1,False,N******2,"Double order by Technical Issue, handled as Intentional Deception",doordash,719972451
2022-11-27 21:34:42,Do not drive for these people being paid the bare minimum for orders is insane ! Not only that I have requested my account to be deactivated due to the fact that the entire customer service is full of idiots ! I turned the app on mind u I have 200 completed orders for them ! I pull up to a place that doesn’t have any of the customers items so I requested it be canceled saying Popeyes is out of the order the girl in the chat canceled the next order I accepted in stead ! So now a customer is upset with her order canceled for no reason and the one I needed canceled was still there after being told I wuld be compensated for the one she mistakenly canceled I realized that compensation wasn’t there called them and wen I tell u they cannot comprehend a single thing in life !!!!! U will have to fight them for your money just to be told they not paying u then why was I told by two different reps I should be receiving payment I didn’t make them tell me this nor did I ask for these orders to be canceled incorrectly now I have wasted my gas and time ! Thank god for Uber eats and grub hub ! Because this app is the lowest !!!!,1,False,kanggggggggggggggg,Worst company,doordash,719972451
2022-11-09 01:40:23,"I have been using dashpass for a year now, in the past even though orders would get messed up, DoorDash did help a lot. But ever since I moved to a new area, the prices and delivery fees went up even after 12+. I use the app because I am a full time student and working in between. Now, I have to pay even more and recently multiple orders have been bad or completely missing multiple items. Today, I hade ordered a meal and a large drink that happened to also be 3 dollars on its own. While I was fine with that, the order came in and it was missing half the items Including that 3 dollar drink. When I went to the help area Again, this time the app just flat out told me it couldn’t help me with refunds and to have a nice day. The app is not worth it anymore. UberEats has restaurants in my area with less fees even Without the pass. In the end I have canceled my subscription and deleted the app, I would rather just put up with ramen noodles for quick meals instead of being charged all this time for a pass that didn’t do much for me eventually",1,False,manny😑,Disappointing end to a year of subscribing,doordash,719972451
2022-10-11 17:07:13,"It seems like every other order of not more, are arriving 30+ min late, missing items, dropped off at the wrong location, sometimes my food never arrives. The best one to see is the dasher is having car issues… I’ve canceled my dash pass several times now, just to use Uber eats and go right back to door dash. Uber eats is super expensive, even with their subscription. But door dash is the most unreliable service I’ve used in my life. I’ve recently just had a chat with customer support because one of my orders weren’t getting delivered, and it was already 20 min past the time of delivery and they were 20 min away. They also picked up my food by the time they stop. The support person was the least charismatic person I’ve meet, telling me their insuring my food wouldn’t be cold and it would arrive soon. Then they just stop the chat out of nowhere… the food was cold and it took a hour an 30 min when it was expected to take 25 min. I’ve spent thousands on door dash in a few years, and nothing gets fixed, you might get some credits but not your food.",1,False,Zanderprice,To many issues,doordash,719972451
2022-10-22 00:55:28,"I ordered food for my family at Disney World. I was given a time quote and the driver messaged me when he arrived at the restaurant.  He said the restaurant was telling him he would have to be waiting much longer past the quoted arrival time.  I apologized as this was just his time wasted.  As my order continued to push out I tried to reach out to customer service to see what my options were.  I couldn’t get anyone.  I had to order other food for my family.  I was able to get them fed and in bed before I got a response from an agent.  My option was to cancel my still in progress order and the driver would not get paid, or continue to wait for a $10 credit.  I choose not to screw over the driver and I received an order of food for a family hours after I was quoted.  Said family was asleep in bed and I could only save what I could pack into a mini fridge.  Oh yeah, and the agent ended our chat once I said I would not cancel and screw the driver.  So I never got my $10 credit.  Never again DoorDash!  Deleting app now!",1,False,albnem,No customer service.  Good luck if you have an issue!,doordash,719972451
2022-09-20 23:49:03,I have one day left here in the state that I’m in this app has f’d me over multiple days in a row when trying to order the app crashes or freezes.I just want to have one final great last night with the bois and order a few drinks to the place that were at. I can open restraints but when I open a liquor store the app freezes. I ordered two times the two nights before this and the order never arrived both times no compensation except for 5 dollars and I have to wait a week for my money back so I can’t order it. My friend is ordering it tonight and the app keeps saying payment issue there is no issue paying the app is at fault. There are more than 10 instances things like this have happened. DoorDash has pretty much been ruining my life for the past year with expectations being crushed and high hopes for nothing,5,False,ur bot,Awful,doordash,719972451
2022-12-14 06:17:54,"I love DoorDash. I order from it probably 3-4 times a week, for home and for special work guests and events. 99% of the time, these orders roll off without a hitch. The one time I have a missing item— the response is shocking, and just plain sad.

DoorDash has quite an impressive “What went wrong?” response platform for their customers. But what good is it, whenever the app then states it’s refusal to issue a credit for any order error. My order was missing an item- quite a simple fix. I submitted my response, chose the item affected, gave a description and opted to give a photo. Got to the “thanks for your response” page— which thanked me for my feedback, but stated that DoorDash doesn’t give refunds or even app-credit for any orders at this time. Very odd, and quite frankly a bit jarring type of response. I’m totally shocked. My family’s restaurant would never do that to a customer— it’s disparaging to see this large corporation integrate this into their business. Please do better DoorDash.",2,False,Sleeperinner,Shocked at the lack of customer support…,doordash,719972451
2022-12-20 22:00:21,"Wish I could give 0 stars. I have had basically every order wrong since using this platform. At the beginning, they give a credit. But it’s never actually even close to the original purchase amount. $3, here maybe $6 there. 

Then I had literally back to back orders wrong. And when I say wrong, I mean COMPLETELY missing items. Even one time, there was complete proof because the delivery driver messaged that the place was out of what I ordered. Door dash refused to ‘compensate’. I never asked for any extra just the money I had spent on items I didn’t ever get. I am furious that I have over $30 + wasted on items I never even got. 

When you contact support, the first message always seems like they will be so helpful but it’s downhill from there. They are rude, unhelpful, and sometimes just completely end the conversation by disconnecting. They always say they will follow up through email and then never do. I will never use doordash again. Never. At this point, it’s theft. They have stolen from me. Money that I work hard for. It’s ridiculous.",1,False,Linds1444,Always. Wrong.,doordash,719972451
2022-10-08 19:52:28,Unfortunately I was unable to continue using doordash because apparently when you have a dasher driver account AND  a personal doordash ordering app under the same email issues can arise. I decided to take the doordash ordering app off my phone because now I want to cook more. Due to me deactivating my personal doordash ordering app it ended up kicking me out of my dasher driver account. I called support and they confirmed that the issue was connecting one email to both accounts. Where it went wrong was when I was ASSURED that both accounts could be separated and that it would take 24/48 hrs.  I let over 48 hrs pass AFTER many log in attempts throughout the day. I called support again today and support then tells me that it is not possible to separate my accounts without reactivating the personal account & changing my email and I think thats unfair that I had to call & find that out. On top of the the support person I spoke also let m know that my request to separate my accounts was never possible so why assure me that it was? That did it for me.,1,False,Lulut19,Dasher issues,doordash,719972451
2022-12-12 01:13:44,"I've tried a lot of food delivery apps over the years. They're all basically the same in my opinion, but the reason I prefer doordash over any other is because of the customer service. Sometimes issues happen with the food or the person delivering the food. That happens with every food delivery service. But the difference is that every time I've asked for customer service help from doordash, I'm always connected to a real person who is actually perfectly reasonable and extremely helpful about what they can do to make things right for me. Also, the ""help"" button is very easy to find. I've found that most other apps try to hide it from you and even when you do find it, you just end up talking to a robot then maybe getting a small refund.",5,False,Imogen McCain,Amazing Customer Service,doordash,719972451
2022-10-28 21:24:35,"I’ve been using door dash for a while now and I’ve also had multiple problems with it, I’ve tried to cancel and get my money back instead of credits because I do not want that. I wanted a full refund and even contacted multiple people that worked for (Door dash) I was told I’d get my money back in a couple of days I’ve been waiting for almost about a week! This is really irritating.. my little sister got a refund on her stuff and she got the money back the next day, but me I’m still waiting. Like I already informed I called about four times and got the same lady telling me I will not get my money back. Door dash as much money some of us spent and worked hard for the money. An buy/ purchase stuff or even give money to people that are working too. I don’t find it fair when i contact someone for a refund I can’t get it back knowing I worked for the money! Do better (Door dash) and the rude people that work there and never would like to help and do they job they got.",2,False,alannah🥺,!!,doordash,719972451
2022-12-20 03:20:30,"I went in to order 2 bags of flamin hot lime Cheetos, and put in a few other bags of chips for my family. I was only informed after ordering that the store did not in fact have the chips I wanted. Fine whatever. Even though it’s the only reason I even ordered. The dasher also can’t find one of the other chips and I have to literally guide him to where they are via text. Then he finds that there is only a bigger more expensive version that I then have to pay more for. THEN they mess up the LAST bag of chips getting the wrong kind therefor rendering them useless as nobody in my house even likes that kind. I’m fed up by this point and look to customer service to see if I can at least get some compensation for the bag of chips that was wrong only to find that I don’t talk to a real person, and the robot tells me how I “unfortunately can’t receive a refund or in store credit due to our new policy” so I’ve spent over twenty dollars with a bag of chips to show for it. Thanks DoorDash. I’m never using you again.",1,False,SadnessPlayer,Just wanted my Cheetos,doordash,719972451
2022-11-07 23:28:11,I can’t believe I have to write this review today on November 7th around 3:00 I had a door dasher named Cristian. At my job we always order food to our work and today I decided to order food Cristian couldn’t follow simple signs where they point where the entrance is instead he wants me to go out of my way to door he’s at. I told him I simply can’t because I’m working. At the entrance there’s always workers that will receive the food for me. So instead he told me I’m wasting HIS time and just left it at a door on SOME MUD. When I finally had time to go the door he left it at I had to take the food out the bag but when I opened the bag my soup was spilled all over my food so I couldn’t even eat it anymore. Im glad I was able to get a some what refund but that would never make up the experience I just had I smell like the soup and covered in it and now I have to wait to get home to eat because I don’t ever want to order food on these apps again. Would be careful because when things happen like this all they can do is apologize.,1,False,Kat lol44,DoorDash order,doordash,719972451
2022-09-16 18:31:53,"While the app itself is “functional”, the user interface was designed by an idiot. 

No way to clear cart without manually deleting each item. Even force closing the app and logging out won’t do it

No way to leave support chat screen with the chat still open

“Need help with current order” just defaults to selecting a past order

App repeatedly asks and fails to verify my card.

Now for my experience with customer support. 

During my first attempt I was connected to someone Named Deepak, who clearly wasn’t paying attention to my problem, as his first 3 suggestions were all negated by my initial description of the problem. 

After accidentally leaving the chat with no way to return due to the aforementioned design flaws made by an idiot,

I attempted a second chat with customer support with someone named Megha. I assume Meghan didn’t fit, but then again Deepak fits, so who knows. 

Regardless they clearly weren’t paying attention either, because their first suggestion was that I “try using the app instead of the desktop site” even though I clearly just said that my problem was in the app, and that the app “will only ask to scan the card for verification” when I specifically said that was the part that doesn’t work. And then they gave up and sent me a “troubleshooting email” so I can fix their poorly designed, apparently buggy software myself. 

I am DEEPLY unimpressed.",2,False,Kur0g4n3,Garbage customer support,doordash,719972451
2022-12-16 19:07:11,"I watch my driver on the app. It’s obvious that several orders are being delivered at once. Because of where I am located, I am always last in line. By the time my food arrives, the things that are supposed to be hot are cold, and the things that are supposed to be cold or frozen are warm or melting. When a special “deal” is offered, and I meet the criteria for the deal, I am still not able to actually get the deal. And all the fees and prices have gone up so much, I often cancel out an order when I see the final total. This is true even with subscribing to the no delivery fee service. When the tip is figured, I don’t know what total they are basing it on. For a $24 order, the “20% tip” was $6.50. When they make a mistake or fail to deliver what has been ordered, they give you $5 back, even when your expense has been much more than that, and someone in your party didn’t get their food.",3,False,Jadesea,Service has deteriorated,doordash,719972451
2022-11-17 19:50:50,"There was a print that said if I added the Dash Pass to my order I could save a little over $4, so I did. It also said that I would get a 30 day free trial and at the end of the :0 days I would be charged $9.99 per month. When I placed my order nothing was deducted from the total so I contacted customer support…the guy who “helped” me didn’t know how to speak English well, had a lot of spelling and grammatical errors, and just represented himself and the company very poorly due to the above and his overall tone. I was honestly shocked. He decided to call me because he couldn’t understand ME, so when we spoke I reiterated everything that had happened, to which he told me he refunded me some money and canceled my Dash Pass. I check my account a few days later to see not only no refund but also a $9.99 charge for the Dash Pass. Needless to say I have deleted their app and will save myself a lot of money by going to get my food myself. These companies don’t care about us, they only care about what they can get away with.",1,False,Really?1234,So unprofessional,doordash,719972451
