date,review,rating,isEdited,userName,title,app_name,app_id
2022-11-25 00:43:21,I know I don’t need to do this many reviews but it beats trying to explain myself like 7 times . I just deleted this app . The rep never fixed my issue . I was simply going to order a pizza and cheese sticks from Pizza Hut . Your app was going to charge me nearly 50 dollars . I went to that resteraunt and ordered the very same thing and got it for less than 30 . They even said wow to that price . I don’t want anymore emails from y’all . The rep still hasn’t fixed the problem. I’m just done with door dash . I will go get the food myself and using the example I just gave save 20 dollars in fees for a store that is like 20 miles from me. Don’t let them lie to you they found my number when they ended the chat because I didn’t provide it . They don’t need the number or email just to answer that one question.,1,False,Tinajune,What people should know,doordash,719972451
2022-10-01 00:23:30,The worst customer service ever!!! Ordered dinner that worth $100  and waited an hour but nothing was delivered even though the driver put my order was delivered. When I reported the problem i was told that my report has been noted and someone was going to contact me but nobody did. I contacted the customer support and they said at first i was supposed to contact them right away when i told them what happened they said wat for an email and of course nothing so I contacted back and they told me that they can’t do anything about my last order and i was not going to get any kind of refund. I’ve been using the app for a few years never had any problem before this so very DISAPPOINTED not sure if i can order something else again knowing I’m not going to get any help if something like this happen again.,1,False,lcfrndrsn,Missing order,doordash,719972451
2022-12-11 02:36:33,"I was looking through dash pass options, clicked a link I thought would take me to more information but it instead immediately subscribed me, something I was not looking to do. So I go to try and cancel the subscription. As I’m doing so, the app offers me 2 months free trial to dash pass. Ok cool, that’s fine. So I follow through with canceling my unintentional subscription. Open the app a few days later to find the dash pass trial is gone. I call and ask about it and am not given any real answer, just told “well there’s nothing we can do about it”. So they made an offer, a promise if you will, I accepted, then they decided they just weren’t going to follow through with it. That they could renege on a deal. Strikes me as shady and unethical at a minimum. So despite using this app routinely, you all have now lost a customer.",1,False,W1018,Used to love this app but,doordash,719972451
2022-11-28 22:16:05,"As DoorDash has evolved it has taken on more and more shady business practices.  Today, if I order say a pizza and a couple sodas but they don’t bring the soda.  They will credit your account instead of bringing you what you paid for already.  This way you have to order again and pay the delivery fees and whatever other bloated charge they want to add on.  Sure you could credit back to the original payment method but that doesn’t change the fact that you didn’t get what you paid for or that you have to pay extra again to get it.  They have tried to take the responsibility off of them by saying “it’s the stores fault”, “our drivers don’t know”….  Well, they used too….  Then you want me to tip the driver who isn’t actually doing anything at all now?  Right………

Like I said….  It used to be good.",1,False,Endemic689,Used to be good,doordash,719972451
2022-11-09 17:42:03,"I usually always go to the store buy & pick up my own food. Recently i’ve been using this app. All the food is taxed on top of the actual price through this app, On top of that you want me to wait an hour for the delivery, and still want me to give the driver a tip. Not happening. My food could usually cost 10$ and i’ll be paying 20$ just for the food before the delivery prices and taxes come in. It can say it’s an 8 minute pick up but 50 minute delivery when the store is down the street.. I’m sorry but this app is really unacceptable looking at it from someone who usually does it themselves. It’s a scam and you guys are getting a lot of money out of this and still want me to pay a tip to the dasher. I’m sorry but you guys can pay the tip if my order is 10$ more then what it usually will be. (not including delivery, taxes, or tip)",1,False,Faithhlol,Ummm…,doordash,719972451
2022-11-15 00:19:47,"I can’t leave a poor review for my driver after I filled a complaint? I waited 45 min for a pop I ordered, it was sent to the completely wrong house. It wasn’t a complicated address. I even gave directions in the description in case they struggled. Yet, my dasher now gets my tip and no poor review. Gets out scotch free. All I get is a REDUND so I can order it again and try again. No coupons, no discount, just a chance to give them their money back all over again. So now, 80+min for my order as I try again. This is why I’ve never used DoorDash and lesson learned, I’ll never use it again after today.

Not to mention, the pop was for kids… by the time they get here they’ll get put in the fridge for tomorrow because it’ll be their bedtime. So now I have to deal with disappointed kids. Thanks.",1,False,Essence Myerholtz,System is messed up,doordash,719972451
2022-10-07 23:29:17,"I use DD all of the time, and I’m even a dasher myself. Though, I feel like there could be some ways the communication between the dasher and their customer(s) can be better.

• a way to see how busy an area is when ordering to get a rough gauge of how long the delivery may take.
• a pop up of sorts, that would encourage a customer to tip more if an area or specific restaurant has long wait times, like for Taco Bell at night time. 
• the ability to let us choose a cash tip option. Sometimes it’s much easier to tip cash, but since it’s a dying currency, I can understand why it’s not an option.",4,False,Skysder,Some suggestions for better dasher-customer communication,doordash,719972451
2022-11-20 16:55:04,"Costumer service really trash and they will send you into very dangerous places and they wouldn’t care  because all about there business not your life even low pay rate when you gotta do more miles then the pay and even in drop off you going to have trouble in the maps never a correct address etc. they even deactivate you if you don’t accept them low balling when they know gas ain’t cheap so really it’s not up to you it’s up the them when you should accept or not. 
This is a horrible company to work for take it as that and keep it moving",5,False,hhhghkkfndndn d z,Dear door dash,doordash,719972451
2022-10-25 19:46:03,"Placing an order using “DoubleDash” to pick up a 2nd order from a nearby place using the same driver to save yourself a delivery fee never works. The system always drops or never submits the 2nd order and then cistern service tells you to just place another order and pay all of the delivery fees and tips for a separate order that will arrive in another 45-90 minutes. Meanwhile the system calculates a Dasher tip based on the double/combined orders, and then when only 1 order arrives, DoorDash refuses to recalculate or refund the double tip amount. 
They chose to permanently lose me as a long-time customer rather than to just simply acknowledge there was some technical issues going on. I closed my account permanently, and all my delivery orders will be through Uber now. 
Sad. 
Goodbye DoorDash",1,False,Xmaximus4X,Using the new “DoubleDash” dual order same driver never works,doordash,719972451
2022-10-21 02:21:32,"When the delivery fees are posted, they should be charged as such. It blows my mind DoorDash gets away with adding additional delivery fees in a section called “taxes and fees.” They should probably categorize the taxes separately so we know we’re not paying tax on any intangible items like their fees on fees. Then they have the audacity to recommend we give like a 35% tip!? We tip on the total of items purchased. Not including the delivery fees and whatever other fees they try to hide. A 20% tip on my $30 purchase (which was $40 after their “2.99” delivery fee) would be $6. And that used to be considered generous. Yet I have to hit “other amount” and type in my generous tip as if I was doing something wrong. I’ll delete the app and use others from now on. Hope the creators are spending their billions wisely. Like not ordering from DoorDash.",1,False,Budeep budeep budeep bye bye,Misleading and,doordash,719972451
2022-09-29 15:20:20,"I use DoorDash all the time it started while @ work when I would have a short lunch breaks but now I use it sometimes @ home too! If you use DD @ least twice a month or more you should get DashPass  IT’S DEFINITELY WORTH IT! Pay annually to save even more money on fees, deliveries & DashPass dues. I’m on a first name basis with most of my local dashers lol but I must admit Ivan is the best he’s a Rockstar! DD is always convenient & prompt. I’ve been using it for yrs & I’ve only had one issue & I use it 3 or 4 times a week sometimes. I love how it’s designed to give you real time updates & info about your order & dasher. Thank you DD!",5,False,Sassybetty78,Love DD & DashPass,doordash,719972451
2022-12-18 18:53:46,"Idk if it’s the drivers or the restaurants but my last three orders I haven’t gotten my drinks. Idk if it’s just a weird glitch , I get my DoorDash credits but I was throughly annoyed this last time. I’m sick today and I ordered a protein smoothie and a side flat bread only got my flat bread and the smoothie was the most expensive part . Then I gotta use my credits pay more money again on top of the credits to get it redelivered.  They should have an option for redleievry for missing items because then the person ordering has to pay another 5/6 dollars on top of the “credits” for the missing item that you already paid to have delivered in the first place? Makes no sense.",3,False,Tbearxoxo,Love door dash but annoyed with the drivers,doordash,719972451
2022-12-03 14:40:19,"So I have been using door dash for years and generally, everything is really good. But I wanted to warn people DO NOT USE EXPRESS for your order. I don't know if this is with everyone but I stay in an apartment and every time I tried to use express delivery they get lost. And every time they call me and I have to come downstairs to meet them to get my food. I never have any problems with standard delivery. They find the place every time. Could be just people starting out or something for the express delivery? I don’t know. Just stick to regular delivery for stuff. Other than that. It’s a good app and I get my food on time.",4,False,The-o23,Good but there is a huge problem,doordash,719972451
2022-11-08 23:55:29,"I use DoorDash and lot, and I have used it for almost 3 years. We have rarely had issues that were not the restaurant’s fault. However, in the last few months, the map function that the app uses has been sending the dashers to the completely wrong street. For years this was not an issue. All of a sudden, every time we order the dasher ends up calling us to say they can’t find our house, and it it can sometimes be a huge hassle to get the dasher to the house. Doordash, please update your maps. This house has been here since 1976, so it’s definitely you and not me.",4,False,swhuggett,Love the ordering function but delivery is problematic,doordash,719972451
2022-10-19 13:01:25,"Let me start with the good: Convenient, reliable (mostly), and fair in comparison to other apps The not so good: Dashers often are late, there’s little accountability other than a refund (more on this) if something is missing or wrong, store menus are not always updated or right. The UGLY: Reviews are kicked back unless they are 4-5🌟. Huge issue with that, it’s fraud! If there’s a review for a place submitted with less than 3 stars, it’s kicked back and not submitted, even if it’s not going against the posted guidelines for a review. This means establishments are not held accountable except for a refund through the application and more people will endure the same poor results. I’m available for verification if needed.",3,False,Juant_me,Glossing over honesty,doordash,719972451
2022-09-11 18:45:10,"I have had many issues with missing food and incorrect orders from various delivery services. Some is fault of restaurant, example giving driver wrong order,missing items. Some is fault of drivers who for whatever reason don’t arrive ,cancel or drop at wrong address and some the APP, example Outback Steakhouse twice now the order defaults to two salads when order sweet potato’s with meals. The discount now offered brought me back,unfortunate first order wrong and so bad no one would eat it,restaurant fault. Second was Outback,missing food app issue and third is pending, certainly they won’t mess up bagels and coffee. Fingers crossed.",4,False,elevenloveseggos,Nice offers brought me back,doordash,719972451
2022-12-20 04:29:15,"But I do. I love the ease of ordering food to be delivered, and the random promotions that are included with some new restaurants that have been added. Having Apple Pay as an option to pay is great as well - I don’t keep a card on file but I do have Apple Pay. Finally, the addition of grocery stores to Doordash has been amazing as well. Sometimes I just don’t want to go to the store and this may sound crazy to those who live in the suburb, but I don’t want to lose my parking spot. Street parking in the Bay Area may be a large reason doordash thrives.",5,False,Heyyk,I shouldn’t love anything this much,doordash,719972451
2022-12-13 19:40:55,Just disappointed I was not reimbursed for when my Thai food order of triple vegetable with beef was not reimbursed like customer support said they would.  We had a three way conversation with the driver myself and customer support who heard the driver say he never did pick up my Thai food order.  Customer support said wait 25 minutes and you should see the refund.  I thought it was safe to reorder and thought I’d get a fresh remake of what I ordered.  Two hours later when I reordered I got delivered my original order and never reimbursed.  I got charged twice for 2 hour old food.,5,False,DbleDash,Double Dash,doordash,719972451
2022-12-08 19:13:22,"Wooow I have been a loyal customer for a long time and I use this service daily. But their customer service has gone downhill recently and I have had it with them. Imagine spending $70+ of your hard earned money on an order to find feathers in your food!!! I threw it all away and asked for compensation since the food was not edible, I was bounced around different sketchy teams of customer support that flat out told me due to the history of your account we cannot compensate you. Keep in mind for the past 100+ orders i have not requested any compensation to make matters worse everytime i try to finish writing this review it starts deleting itself, Worst customer service ever save your money as they will steal it and go with any other app that offers similar services. This one is not worth it",1,False,Abdulx72,Terrible customer service,doordash,719972451
2022-10-26 21:57:40,Every single time I order anything through this app there is an issue or inconvenience. The ONLY reason I’m still using this app is because my money is tied up in credits that has to be used before I am able to delete this entire app. These drivers are poor sorry excuse for working citizens. They are very lazy and most are too illiterate to follow simple directions such as HAND IT TO ME! Dashers will pick up the call but not the order. I’ve had dashers literally sitting in the parking lot high off drugs while I’m waiting on my order to be delivered. Called the merchant only for them to say they have completed my order 45 minutes ago. Gets up and go to the place and the dasher is over dosing in the parking lot from some type of drug with my food in the car. These people hire anybody but refused to hire me. Tuh!,1,False,MyLadyBugShia,POOR SERVICE,doordash,719972451
2022-10-20 19:58:18,"Grocery stores are bugged. I can only order from food places with small menus but with places that have a large menu/more items to load the app crashes and gets stuck on the loading animation and eventually freezes(animation and no touch control) Restarting, redownloading, different devices(I’ve tried 3 apple devices) or different profiles do not fix this issue. As an app developer I know these things can happen and hope this review gets seen and fixed because this error makes me use Uber eats instead when I originally just use door dash, y’all are losing my service so please fix this! I’m sure it’s not just me as my gf has the same issue and she completely deleted the app and exclusively uses Uber eats now",2,False,kN1N3,Laggy and buggy,doordash,719972451
2022-09-24 21:36:16,"Time and time again I order something from my town, and time and time again I don’t receive my full order. I process through the “help” tab, I do not want a refund I want the food I ordered for my wife. Consistently we have one of our meals left at the resturant even though we ordered two. The only solution offered by the horrible support service is a refund for your food. Not for the tip, not for the delivery fee, just the food. So if I actually want my order I have to go back and spend even MORE on those things when it wasn’t right the first time. Let me be clear when I say this has happened CONSOSTENTLY. It’s one thing if things are forgotten, but to pay MORE to have what was forgotten re-delivered? Horrible service.",2,False,Darkstarmorris330,Very reoccurring customer,doordash,719972451
2022-09-14 17:39:40,"At least half of the dashers will be people too incompetent to get hired at any job. You’ll buy an $8 meal but after Doordash fees and tip it’ll be $22. Oh, but you can spend $12 a month to get rid of scummy fees, but only if what you order is over $10 in food 🤷🏼‍♀️ you’re better off spending that money on gas and going to get your food yourself. 
I ordered a burger for me and nuggets with fries for my girlfriend, we received only the fries. Doordash at least let’s you refund if there’s a problem… only one item though 🤷🏼‍♀️ 

Go get your food yourself. Do not overpay to have some disgusting unsanitary random stranger to handle your food. I have had instances where the seal was broken and we suddenly have 6 fries total. Doordash will let LITERALLY anyone deliver. It’s easier to become a driver than it is to buy a gun in Texas.",1,False,hoymeister,Do not use this crap,doordash,719972451
2022-10-15 23:08:18,"Functionally a fine app. But note to Devs: when you go to pull up an old order that is VERY old and thus probably not archived anymore, it fails in an ugly way. For example, rather than showing a page saying that there was an error, it shows a white screen with something that someone on the backend would want to see (“something goes wrong to fetch order with detail,…”). The message changes depending on the order, but if you click the same order over and over the message that is shown stays the same. Maybe something to fix for the next version?",4,False,robmoray,Does Not Handle Archiving of Old Orders Gracefully,doordash,719972451
2022-11-05 17:18:22,"As much I’m not a fan of new technologies today but in all due reality this has been amazing just like Uber eats. But DoorDash has been allot easier to use other than Uber eats. Especially for people like me who gets tired coming home from work cause I work graveyards and I do get tired to go anywhere…. I give thanks to the people who is willing to deliver food and other convenience stuff.. and also along with Uber I am thankful for that technology as well to give people rides and from where ever they needed to be… I am grateful for both feature.. 

God bless you all 🙏🏽🙂",5,False,Dorian Maniscalco,Love this technology,doordash,719972451
2022-11-07 19:19:40,"The food is excellent and delivered fast *for a large fee*. They will send your favorite foods to your house *at their own prices*. Their prices are higher than the restaurants, but if you sign up for their promotion then you can have it delivered for FREE *kinda* don’t forget the extra driver charge, and don’t forget to add the express option to insure your driver doesn’t take your food on a wild 30 minute ride. Oh yea and if your order gets messed up they’ll totally reimburse you!* but not really* did your 15 waffle not come with everything like utensils butter or syrup, that’s okay they’ll give you a 1.10 credit towards your next rip off session. Did you accidentally order your food to a different state, don’t worry they’ll warn you that it seems like you’re far away. *sometimes*",1,False,TommySeason,Marked up and always late,doordash,719972451
2022-09-22 18:20:53,"This app works great but over the past couple of months, I’ve noticed that everything is more expensive than the actual restaurants charge — I’ll literally go on the restaurant’s website and see their cost for the item.. and then on Door Dash, it’s anywhere between $3-$6 more… per item!! That’s ridiculous. Between all of the extra fees and increase on food items, it’s cheaper for me to just use gas and pick up directly from the restaurant instead of going through DD. At least the restaurant won’t charge the extra fees (and I’m a Dash Pass member too..). Is DD pocketing the difference between what the restaurant charges and what’s on the app??",3,False,Nat201678,Why Does DD Charge More Than the Restaurant for Food??,doordash,719972451
2022-12-19 06:02:48,I scheduled ahead of time a delivery of pizzas for a party we had planned and after the time the pizza should have arrived I received a call from door dash customer service telling me that my order would need to be canceled because it couldn't be fullfilled but I could try reordering the same order again (which wouldve taken up to 2 hours to fulfill). The customer service person actually hung up on me when I inquired why I would reorder with no garuntee that it'd be fulfilled. I have never left a bad review before but this isn't the first problem I've encountered with door dash nor the first time I've been hung up on by them. I will not be renewing my membership and I suggest you look at other options for your food delivery service. This company is horrible.,1,False,Jonahmaer,Such horrible customer service,doordash,719972451
2022-12-09 08:45:59,"So, I have been using this app for a year. I have been having a problem to get my order as the dasher in my area keep not delivering my order and it takes three days to get my refund. There is no way to contact your dasher as from one call to the customer service they stated that the number in the app is not related to dasher but to the assistant or something like that. It’s just very easy for the dasher to submit that the order was dropped off, but there is no integrity check even though “technology now can detect food package using AI and machine learning”. However, it was easy to request a refund, but how could they refund the wasted time? So I decided to eat healthy and not waste time. Also I am a student, so getting my refund in three days is a big deal to me.",1,False,Euiiioooooooo,I deleted for the lack of integrity,doordash,719972451
2022-11-14 13:13:06,"Probably done 100 orders on door dash, Been getting meals 30 min delays. Not the drivers fault. The calculations are way off. It’s getting annoying.

Started ordering from this Taco Bell that constantly messed up my orders. First 3 times DD refunded my money instantly, it was away s 2 small items. Then one day they said no more refunds. Got on with help center. They refused to help. Kept sending robot responses. I said cool you are just doing your job, please send confirmation you have sent this issue further up the chain, I even have video proof of me opening the food bags. No confirmation email. No reply to me requesting that I wanted a confirmation email. They would close the chat, i would re open it and they kept shutting down the chat. I would expect this of a scam caller, but not a big corporation. Very garbage.",1,False,12iphonemini12,100 orders,doordash,719972451
2022-10-11 19:42:47,"It’s painfully obvious that you don’t pay your Dashers as you should. Tipping them as much as I am, I feel like I am footing the paycheck. You shouldn’t suggest as much as you do, and I shouldn’t have to tip like I do. 

Also. At least give me the opportunity to give a tip AFTER I receive the meal. Why would I tip without knowing what the service quality is. It doesn’t make any sense. Half the time there is an issue with the order of delivery time is wrong. And I’m not new here. I’ve spent a good portion of my income receiving food. 

I still love the service option, but you need to adjust the cost, because I can compare to other services that clearly don’t try and make me feel bad about offering a tip I can afford. And a tip is for extra, not for the expected service.",1,False,Mrsassy1,Pay your Dashers so I don’t have to,doordash,719972451
