date,review,rating,isEdited,userName,title,app_name,app_id
2022-12-04 13:33:13,"Okay this review is coming from a customer and a merchant point of view. As a customer I have been screwed over by doordash countless times; cold food, missing items, cancelled order an hour after I placed it, etc. everyone is short staffed (I manage a restaurant) so if you do not have drivers why are you allowing customers to place orders?? If a customer complains that the food is extremely cold or has a major piece missing why do you think $5 or less CREDIT is suffice?? As a merchant; if the first driver cancels after they have already picked it up, why not notify the restaurant so we can remake in a timely manner for the next driver, and the customer?? Also check the attitude of some of your drivers, you send them to the restaurant 10-15 minutes BEFORE the order is scheduled to be picked up and we receive nothing but attitude at the restaurant. All and all this company needs to reassess how they do business. I should not be upset as a customer and merchant.",1,False,Elora326,THE ABSOLUTE WORST,doordash,719972451
2022-09-25 21:06:28,"I ordered from a restaurant last Friday when DoorDash app said delivery time is 57 mins. But after placing the order, delivery time changed to 80 mins which is too long. So within 2 mins, I called the restaurant to cancel the order, but they can’t do it via DoorDash. I so contacted DoorDash agent who helped me cancel the order and also confirmed that the order was cancelled. The restaurant also called me twice to confirm I don’t want this order and I want to cancel it.

But two hours later, DoorDash app said I was charged and the order was completed. I believe DoorDash still assigned a dasher to this order and when the dasher showed up in the restaurant, he/she asked the restaurant to prepare for this order. I contacted the second DoorDash agent. The agent confirmed with me that the first agent did help me cancel this order, but there are system errors. The agent escalated this issue to their escalation team.

I waited for more than 24 hours but all I got back from the escalation team is an email written in a standard template by a bot saying that the refund request is not approved by DoorDash’s policy.

I contacted DoorDash again. Their supervisor just repeated the same thing to me: your case has been reviewed by our escalation team and your refund request is not approved.

Super disappointed about DoorDash. They ask customers to pay for their own system errors.",1,False,hdiismsbbs,I got charged for a cancelled order without any reason,doordash,719972451
2022-12-04 02:59:17,"This company is horrible. First, some of the drivers are bad. Just bad. There has been more than one occasion where I ordered food and the driver never delivered it and I called the company and they offered no refund. I called the restaurant but they said the dasher had picked up the food so they understandably couldn’t do anything. Other times the restaurant got my orders completely wrong. I specifically Star on all my orders if you are out of something or can’t make my order, don’t substitute, call me or at the very least cancel the order. The restaurant did neither and doordash didn’t give me a refund. They didn’t even give me credit. And because I have been very ill in 2022 I haven’t been able to leave home a lot this year so I depended on services like this a LOT. They treat they handicapped like crap.

One time I ordered alcohol and a driver left it on the street. In California. Which is against the law. I called Door Dash to complain. They didn’t care.",1,False,3GSfun,Horrible customer service,doordash,719972451
2022-09-17 00:40:09,"They always do everything right last time, always getting my order right, I just don’t mind the missing items at all, but this time I’m quitting this app and uninstall it, one of the dasher’s name is Vincent stolen my big meal order from Taco Bell, trying to trick into thinking it is here at my front of my doorstep but it’s not, and never there so I cancel my subscription and everything else and never will come back here again, they needed a better dasher and higher security to prevent thefts from stealing our food that we ordered, such a ashame, never wanna use this again, I can see why the DoorDasher didn’t even take a photo screenshot for proof that it is laying right in front of my doorstep….so it is definitely stolen, I looked everywhere for my meal even in the neighbor’s next door house on the front of there doorstep… never again!! Almost $100 down the drain, customer service is still horrible… I wanted my refund now!!",1,False,Issemistdoll222,I don’t want to order from them again,doordash,719972451
2022-11-19 17:51:39,"Look I LOVED door dash. I’ve had and used a dash pass regularly since it became available! For a long time, this was great, but recently, 9 times out of 10 my order is missing something. Whether it be my drink, my sides, ingredients I wanted added or removed, or sometimes even whole entrees. 

And for the first month or so, door dash was good about refunding missing items. Something changed though, and now when a $9 item is missing, they only offer a $2 DOOR DASH CREDIT, and recently, they can’t even give me that. The last time I used them, all of my family’s sides were missing, probably costing close to $20 and they offered zero compensation. I’m losing money AND I don’t get what I ordered. And whether it’s the store’s fault or the dasher’s fault, I still pay for things I don’t receive. It’s frustrating and a waste of money. This was great during COVID, but now I’d rather just go pick up my food so I can be SURE that I have everything.",1,False,Jaja_Julia,Always something missing,doordash,719972451
2022-11-15 05:10:19,I ordered McDonald’s from broadway 1 hour before they closed and they canceled my order 10 minutes after placing my order and taking my money i then called DoorDash and they told me I will receive a refund 3-5 business days I then went on to explain to the agent that was my last little bit of money I had to feed my family and that’s the only thing I have to feed my family I have two children who are hungry right now I have no car which is why I’m using DoorDash the agent was no help I asked for a supervisor trying to explain my situation he then leaves me on hold for an hour tells me no supervisor is available and continue to give me the run around to speak to a manger I’m overly furious about this situation it didn’t take 3-5 business days to take my money out my account it shouldn’t take 3 days to go back into my account he then go on to try to offer me $10 in DoorDash credit like that’s going to be enough for food,1,False,etrinidy,UNPROFESSIONAL AND NOT HELPFUL,doordash,719972451
2022-12-12 21:15:59,"I used DoorDash once and took advantage of “free delivery” for your first order, because of their new partnership with Chick-fil-a. I ended up with a $5 credit because my order was an hour late, completely wrong and very cold. In trying to use up my credit, I noticed that prices were higher normal. I opened up my Postmates account and noticed that every single item I viewed from multiple restaurants was $1-$3 higher, with a higher delivery fee. In fact, the price of the food was more than if I ordered directly from the restaurant. What a disaster, I haven’t used my $5 credit and am tempted to treat it as a loss.

They have the delivery notifications with their ad notifications. Meaning you either receive delivery notifications and updates or you don’t to avoid the STUPID ads. We’re already using the app . Back off!",3,False,Her_Hiness,Crazy high markups,doordash,719972451
2022-12-06 20:30:28,"Honestly I’ve spent thousands of dollars over several years with this company and they can never get anything right. It now takes HOURS for my food to arrive when it used to be fairly reliable and reasonable just about a year ago. Now you have to PAY EXTRA on top of paying a dash pass fee to get your food “faster.” That’s the whole point of a dash pass? Never had to pay that until recently. 
I’ve ordered an hour ahead so it can get here on time when I’m taking lunch at work and it still takes them 2 hours to get a dasher to bring my food. Maybe DoorDash should pay their drivers more and have less restrictions on who can dash because I tried to dash myself for over two years and they never accept me. Take care of your dashers and maybe you’ll be able to retain the good ones. Do better DoorDash. I’m cancelling my dash pass with you and using another platform now. You lost yet another loyal customer and their business!",1,False,blank166254,Downfall,doordash,719972451
2022-11-02 00:21:11,"I love using Door Dash, especially when your driver comes directly to your house. The time is as stated and the food is hot.  However, when the driver is stopping to drop off other orders, not always from the same place, my order is usually the second delivery. We have had drivers drop off the other order to our house. They cannot go back and exchange the order for health reasons. An hour and a half went by and we were refunded for the meal. No food! The delivery takes much more time when they go somewhere else and the food is often cold. One time I checked to see where the driver was on the road. The restaurant was fairly close to our home but his route took him in the opposite direction. I would be willing to give bigger tips if I knew I was the priority.",4,False,CustomerSandy,Delivery,doordash,719972451
2022-11-28 17:20:39,"I would do 0 stars if I could. DoorDash is absolutely the worst app to use for food delivery. Customer service is absolutely terrible, they should not even be called customer service because they do absolutely nothing to help!!! I work in a location that doesn’t allow cars on the street, so I always make sure to specify which business it is and where it is when ordering food. It’s not a problem most of the time, and sometimes the dashers will message or call me if they need help. This time the dasher left my food at another location on the street that was unclear. I therefore didn’t get my food cause I couldn’t find it! I contacted support and they emailed me a pic of my food left outside of a closed building in the rain! Then said they can’t help me the policy won’t let them. Unacceptable. I will be deleting this app. Don’t waste your hard earned money here. The worst part is I even left the imbecile a tip!",1,False,rose1317,Please use any other food delivery service.,doordash,719972451
2022-11-13 03:51:13,"Door dash has been AWFUL!! At first they, they were amazing. I only had an issue here or there and always opted for credits instead of asking for my money back and they handled it really well the couple times something did happen. I spent SO much money ordering from door dash minimum 2-5 times a week every single week. 

The last month or two I have had an issue with almost every single order I’ve made. It started literally taking 2 hours for my food to get to my house and 3 times, the app was showing that my dasher was close by for 2 hours but after I contacted support I found out the dasher never picked up my order and since it was so late at night, I couldn’t order anything else and they wouldn’t give me a refund. I’ve had at least 5 issues just like that since then and they handled it so poorly. For as much money as I spent with them, I’m so disappointed with how they decide to repay loyalty.",1,False,OdinOlive23,Treat loyal customers AWFUL,doordash,719972451
2022-10-04 22:07:01,"I usually order from the web page for Doordash but decided to use the app. I don’t know what is going on, but now my orders are always missing something or the dasher just doesn’t show up. I waited 45 min for an order that was supposedly taken to the wrong address. Dasher did not follow the instructions to text when arrive, it seems she wanted to keep the food. I spoke to her over the phone 1x and she still supposedly ended up at the wrong address again and left my food there. Now I have to wait another 45 mins. For a redelivery, I will not be using this app again. Oh and when I called customer service the rep could barely speak English and was speaking some words in Chinese. Will only order from a browser from now on too many problems using this app!

Stuck on review store page and will not let me exit out to review my new order",2,False,Lovely22154,App stuck on review store page,doordash,719972451
2022-11-26 00:02:05,"This app is awful. They overcharge on their food and often get orders wrong and offer no recourse or refund. If a $15 item isn’t what you ordered, you’ll receive $3.50 as a refund, if they even agree to that. If you try to report an issue and the app crashes, they claim it is “resolved” and won’t refund you. If you call to report a problem with an order, you’ll be put on a long hold and speak with someone who has little power to provide refunds and makes no effort to even understand what you’re reporting. If an order doesn’t arrive, they’ll claim a 24 hr team is looking into it, report the issue was resolved, and will not refund you. Essentially, when they mess up, and they will, and often, they don’t even try to do right by the customer.

I was a loyal customer for over a year and finally got fed up. DD is awful to customers, they’re awful to drivers, and they’re awful in general.",1,False,47183@,Terrible Service that WILL NOT Refund You,doordash,719972451
2022-10-21 04:13:28,"I’ve been on DoorDash for a while and most of the time don’t have problems. But here of late it seems Doordash will let any idiot with a license work for them. Today I ordered a burger with biscuits and gravy. Instead I received someone else’s order of tater tots, chilli cheese fries and something else idk. 

Doordash I’m talking to you, CHECK who you let drive for you. I use this app when I can’t get food in the house and when I receive the wrong order or missing items because YOU hired incompetent people that happen to have a license, it makes you look bad. The only thing consistent about your services is the fact your drivers are NEVER consistent or correct. They deliver items to wrong addresses, steal food, flat out don’t deliver, or can’t seem to tell he difference between one order and another. Fix this or a better app will replace you and people will happily flock to a delivery service that knows what they’re doing.",1,False,Sarah T Wills,Terrible dashers and service,doordash,719972451
2022-11-18 19:27:54,"YOU HAVE BEEN WARNED!!IF YOU HAVE CARE ABOUT YOUR MONEY OR HAVE FINANCIAL PROBLEMS, DONT BOTHER ORDERING HERE!!! ITS THEFT!! GO TO UBEREATS! ITS SLIGHTLY MORE ON PRICE BUT THEY ARE PRECISE!!!if i could give a 0 i would, my last 3 experience hurt financially because they basically stole my money and food. i made an order with taco bell yesterday 6 am and waited an hour for the store to say they couldnt find my order-.- THEN later that day i made an order and my dasher with towards henderson instead of north las vegas and when he got to me half my food was missing and it was all cold. then just now i made a Dennys order and it was accidentally for pick up which i chose delivery okay, and i contact support for them to say they can cancel it and i can reorder it, so she did and connected me to another agent who couldnt refund me…. so my order was canceled so i didnt have a choice but to donate $50 which 2/3 of it was not mine, now i owe money and food to 2 people thanks to doordash, plus i lost atleast $50 from yesterdays order.",1,False,ChristineG1948,YOU HAVE BEEB WARNED!!!,doordash,719972451
2022-11-01 00:34:25,"Yes, I personally have the ability to go out and grab my food. But what if I was sick or I couldn’t or my circumstances were more severe? This isn’t the best app to use if your order gets messed up. My experience was really terrible over compensated apologies from customer service…which seemed more like a robot. When I tried to resolve my problem they said it was outside of the window of resolution but never told me upon submitting my issue how long I had to resolve it.. so that’s interesting.. The company isn’t customer service forward, ok. It’s about getting cash quickly and dusting your hands of actually having to be involved with dealing with minor issues. 
If you plan to have a company, be prepared to deal with people and serve them if they pay for your expensive fees. 
& if not, I guess in 5 years someone else will find a way to do it better. 
I’d think I’d consider the Uber app instead if I were you.",1,False,Britta A,"We are lazy, but so are you",doordash,719972451
2022-10-08 03:42:53,"I have used DoorDash for the past few years and everything about them has been continuously declining! I have never had the issues with other food delivery companies that I’ve had with Door Dash, which includes, but is not limited to,  long delivery times, unfriendly “Dashers”, missing food, cold food, CANCELLED orders after waiting on them AND WITHOUT ANY EXPLANATION (TWICE)!! But I have to say, the “final straw” for me is the huge price markups on food items!!! Like, seriously?? The delivery fees and “service fees” aren’t enough ya’ll have to gouge us customers even more in this terrible economy right now?? (And I DO tip well, always have)!! I am disabled and don’t drive, so I sometimes use these food delivery services to deliver a meal to my home, especially my lil 11 yr old Grandson comes to stay with me, but I’m sorry DoorDash, we’ve reached the end of our journey together…..I must now delete u from my phone…..Sorry, not sorry! Good luck to your future.",1,False,Rockstarmamaw71,Breaking up with DoorDash…….,doordash,719972451
2022-11-10 17:56:16,"The escalation team was suppose to give me a call back after I was told many times by the door dash representatives that they were not allowed to transfer me over to a supervisor in the escalation teams about food I never received. They are horrible when it comes to their customer service and all the representatives were no help to me at all when it came to resolving my issues, I was told the escalation teams didn’t have a direct number which is completely unacceptable and I will not be doing business with door dash , they never followed up with me or not even a email. The representative was not helpful and the supervisor never followed up with me after the incident. I do not recommend door dash to anyone , Uber eats is provides better customer service for the customers so I will be taking my business to Uber eats where the representatives are more professional and knowledgeable",1,False,fsn1848,Horrible service and horrible representatives,doordash,719972451
2022-09-11 06:14:03,"For some given reason my app just decided to lag so bad when ever I try searching up restaurants or stores or just do anything it general, adding to the wound, some local stores don’t show up on my account but as soon as I log off and continue as guest they appear right ways but of course the amount I pay for delivery would be way more since I won’t be able to use the dash pass I have in my actual account. When I reached out to customer support about it all I was told was to wait and see if the problem go fixed by their updates however it seems that every update just keeps making it worst and worst. help anyone 🤷‍♂️",5,False,tunafishsticks,It’s lagging beyond Possible,doordash,719972451
2022-12-03 21:17:04,"Today my order was not delivered and I had proof because the restaurant told me that the order was still sitting there but Doordash showed it was delivered. I asked Doordash to fix the order delivery so someone else could pick it up. They told me that they couldn’t do this and they did not give me a refund either. 

I am extremely upset since I’m a high ordering customer - I order almost every 2 days and I rarely report issues, the last issue I reported that resulted in a refund was in Sept 2022. I don’t blame the customer support folks since they were also frustrated and unable to help. However I do 100% blame the company policy and structures that limits their support team in truly caring for their customers. 

I am a strong believer in customer support and loyalty and don’t prop up companies who will leave their customers hanging. So I will stop using Doordash in the future and urge others to do the same.",1,False,mgghurye,Doordash is horrible,doordash,719972451
2022-09-26 13:36:46,"I genuinely despise this app. Every time I think I’ll try it again, within my first couple orders my order gets stolen by my dasher. My favorite time was when my wife was in labor at the hospital. Finally writing a review today, because unfortunately this is the only thing I can do. It’s infuriating.

Ordered some breakfast today because we lost power and thought it would be nice to have some coffee. Dasher today never arrived, never attempted contact, and kept the order. Order was marked “delivered”. Customer support refunded me, but were unhelpful otherwise. No answers, and chalked the experience up to “our dashers are encouraged to wait, but we allow them to customize their own experience. We know how frustrating this can be!”. We were by our front door with the windows open the whole time, so apparently customizing their own experience means stealing the food and never arriving.",1,False,Memos41,"Food was stolen by my dasher, again.",doordash,719972451
2022-11-07 16:10:02,"There’s always been some problems. In general I liked DoorDash because you could get food when you don’t feel like cooking or going out. It becomes a problem when you wait an hour to receive food you can’t or don’t want to eat. The mix ups have been increasing to where more orders are wrong than those that are right. Order times are going from 30 minutes to 60-90 minutes because they’re combining orders every time. The final straw is that the last two orders were someone else’s order. Wrong restaurant, wrong items. One time it was someone’s $120 multiple item UberEats order that contained mostly seafood dishes that we did not want to eat. Last time was ordering breakfast food and getting someone else’s burritos. It’s a huge waste of food and it’s hugely disappointing. It’s no longer worth the gamble of maybe we get something we want, maybe we don’t.",1,False,Twyggs,"Wrong orders, incorrect orders, slow",doordash,719972451
2022-10-23 03:53:21,"There is no way to search a specific stores menu-the search functionality just searches EVERY restaurant, not the one you click on. For stores that have long menus, it’s so frustrating to endlessly be scrolling up and down AND if the item is out of stock, rather than DoorDash just marking it as out of stock, it disappears from the menu-so you just end up scrolling more. Honestly, this seems like a design choice they made to get people to “discover” more items to add to cart. 

Finally, the compensation they offer unless you select the ‘item is missing’ when an item delivered is incorrect will be such a small percentage of the item that it in no way covers a replacement or even your time if you need to reorder for allergy/preferences.",3,False,M Grafs,User hostile design; often bad compensation,doordash,719972451
2022-12-08 23:25:18,"I had to switch from this food delivery app. The prices have gotten worse and worse since I started using this app years ago. Not only do they charge an absurd handling fee on top of the delivery fee, but they increase the price of everything on restaurants menus. The normal price of a burger from your favorite restaurant becomes even more expensive when using the app. The restaurant receipt was stapled to my last order and it came to a total of 54$, the DoorDash cost for the food alone was nearly 75$ before they added the handling fee, delivery fee, taxes and tip. The 54$ meal it would have cost to pick up became nearly 100$ meal. I always thought it was the restaurants who were upping their prices during Covid, but it turns out it was just DoorDash marking everything up. I get you pay for convenience, but they sure hide a lot of their markup. Other apps provide lower fees and actual restaurant prices.",1,False,dumbledeedoris,Very overpriced,doordash,719972451
2022-11-16 03:41:22,"I have had regular problems with DoorDash. Items missing, brought to wrong door, yesterday it was spilled coffee all over bag and about 2/3 of drink left. Then there’s the times when I order at seven and they have so few drivers I’m still waiting at ten and several times I ordered and waited until the store closed and the order got canceled. Other times if I remember to order before seven, I got it okay and everting was good. It is convenient to use them because I am wheelchair bound and can’t drive . It gets frustrating not getting what you ordered but you just have to take the bad with the good. They don’t have much control over how good their drivers are. They do the best they can by refunding your money. It would just be nice to always get what you ordered in good condition.",3,False,vickipansy,Ups and downs.,doordash,719972451
